{
  "$schema": "../schemas/profile.schema.json",
  "schemaVersion": 1,
  "id": "fond-renovacii-2019",
  "customer": "Московский фонд реновации жилой застройки",
  "doc": "IX. Внутренние системы водопровода, канализации и водостока. Альбом рекомендаций",
  "edition": "Москва, 2019",
  "source": "Файл заказчика «Литература/Реновация.pdf» (скан, 32 стр.). Печатных номеров страниц в альбоме нет: «с. N» — номер страницы PDF.",
  "basis": "СП 5.13130.2009, СП 10.13130.2009, СП 30.13330.2016, СП 113.13330.2016, СП 154.13130.2013 (перечень на с. 32). Для АУП СП 5.13130.2009 заменён СП 485.1311500.2020: профиль может только ужесточать СП 485, но не ослаблять.",
  "verified": false,
  "notes": [
    "Перенесены требования, относящиеся к АУП, совмещённому ВПВ на сети АУП и насосной АПТ. Требования к хозяйственно-питьевому водопроводу, ГВС, канализации, водостоку, внутриквартирным ПК-Б и устройствам первичного пожаротушения (с. 2–16, 18–26) — вне объёма Water_Auto и не перенесены.",
    "Требования к ВПВ здания, которые могут понадобиться при совмещённой насосной: патрубки для передвижной техники при 17 этажах и более, ПК на высоте 1,35 ± 0,15 м, автоматический пуск насосов при высоте здания более 50 м (с. 2); двухзонный противопожарный водопровод при давлении больше 90 м у нижнего ПК (с. 4–5). Не перенесены как записи профиля: к расчёту АУП не относятся."
  ],
  "records": [
    {
      "id": "fr2019.sprinkler.maxSpacing",
      "page": "с. 29, 30",
      "kind": "recommendation",
      "statement": "Расстояние между спринклерными оросителями в автостоянке рекомендуется принимать не более 3 м.",
      "values": { "maxSpacing": 3.0 },
      "units": { "maxSpacing": "м" },
      "tightens": { "norm": "sp485.t6_1.group2", "key": "maxSpacing", "bound": "max" },
      "note": "СП 485, табл. 6.1, группа 2 — не более 3,5 м."
    },
    {
      "id": "fr2019.pipes.materialAndJoints",
      "page": "с. 17",
      "kind": "requirement",
      "statement": "Магистральные трубопроводы и стояки, включая хозяйственно-питьевую и противопожарную насосные, — стальные оцинкованные по ГОСТ 3262-75. Сварка оцинкованных труб не допускается: соединения грувлочные при Ø ≥ 25 мм и резьбовые при Ø < 25 мм. Грувлочные соединения учитывать в спецификации.",
      "values": { "groovedFromDiameter": 25 },
      "units": { "groovedFromDiameter": "мм" },
      "attrs": {
        "standard": "ГОСТ 3262-75",
        "coating": "оцинкованная",
        "weldingAllowed": false,
        "jointsBelow": "резьба",
        "jointsFrom": "грувлочные",
        "inSpecification": "грувлочные соединения и фитинги отдельными позициями"
      }
    },
    {
      "id": "fr2019.hydrants.network",
      "page": "с. 29, 30",
      "kind": "requirement",
      "statement": "Автостоянка: при числе пожарных кранов менее 12 ПК DN65 подключаются к спринклерной сети; при 12 и более — отдельная распределительная (кольцевая) сеть противопожарного водопровода с общими со спринклерной установкой насосами.",
      "values": { "hydrantCountThreshold": 12 },
      "units": { "hydrantCountThreshold": "шт." },
      "attrs": {
        "below": "ПК на спринклерной сети",
        "atOrAbove": "отдельная кольцевая сеть ВПВ DN80–100, насосы общие с АУП"
      }
    },
    {
      "id": "fr2019.pumpStation.room",
      "page": "с. 31; с. 18",
      "kind": "requirement",
      "statement": "Насосная станция спринклерного пожаротушения — в отдельном помещении, как правило в автостоянке. В здании рекомендуется раздельные помещения хозяйственно-питьевой и противопожарной насосной, водомерного узла, ИТП и спринклерной насосной.",
      "attrs": { "location": "автостоянка", "separateRoom": true }
    },
    {
      "id": "fr2019.pumpStation.factory",
      "page": "с. 27, 31",
      "kind": "recommendation",
      "statement": "Насосная установка пожаротушения — станция заводского изготовления с сертификатом и протоколом испытаний, готовая к подключению: прибор управления; общая рама; центробежные насосы 1 рабочий + 1 резервный; всасывающий и напорный коллекторы из нержавеющей стали с разделительными затворами; запорная арматура на всасывании и нагнетании каждого насоса с концевыми выключателями; датчик давления. Допускается вертикальная компоновка насосов.",
      "values": { "workingPumps": 1, "standbyPumps": 1 },
      "units": { "workingPumps": "шт.", "standbyPumps": "шт." },
      "attrs": {
        "composition": ["прибор управления", "общая рама", "центробежные насосы 1 раб. + 1 рез.", "коллекторы из нержавеющей стали с разделительными затворами", "запорная арматура с концевыми выключателями на всасывании и нагнетании каждого насоса", "датчик давления"],
        "documents": "сертификат соответствия, протокол испытаний"
      },
      "note": "Используется как шаблон опросного листа ПТ.ОЛ (golden_set.md §1, §5)."
    },
    {
      "id": "fr2019.pumpStation.jockeyOptional",
      "page": "с. 31",
      "kind": "info",
      "statement": "Альбом допускает станции заводского изготовления двух вариантов: с жокей-насосом и без жокей-насоса.",
      "note": "Ослабить норму профиль не может: по СП 485, п. 6.9.4, автоматический водопитатель обязателен (сосуд, жокей-насос с мембранной ёмкостью ≥ 40 л или водопровод с давлением и расходом не меньше, чем у жокей-насоса). Без жокей-насоса программа требует другой вид водопитателя и выдаёт замечание."
    },
    {
      "id": "fr2019.pumpStation.scheme",
      "page": "с. 29, 30",
      "kind": "recommendation",
      "statement": "Типовая схема насосной АПТ и ВПВ автостоянки: два ввода Д150 от водопровода; рабочий и резервный насосы и жокей-насос; мембранная ёмкость на Д32 (подключение — по конструкции установки); узлы управления КСК Д150 на каждое направление (рампа, помещения стоянки) с дисковыми затворами с датчиком положения; два патрубка Д80 с головками ГМ-80 для передвижной техники с обратными клапанами; сигнализаторы потока; промывочные краны; манометры электроконтактные и показывающие; Ø15 в буферную зону водопровода. Диаметры на схеме условные, определяются расчётом.",
      "attrs": {
        "elements": ["2 ввода Д150", "насосы раб. + рез.", "жокей-насос", "мембранная ёмкость", "КСК Д150 на направление", "дисковые затворы с датчиком положения", "2 патрубка Д80 с ГМ-80", "обратные клапаны", "сигнализаторы потока", "промывочные краны", "манометры электроконтактные и показывающие"]
      },
      "note": "Чек-лист листа ПТ-7 (golden_set.md §5)."
    }
  ]
}
